<?xml version="1.0"?>
<!DOCTYPE Report
[
<!ELEMENT Report (General ,(Doc|BPT)) >
<!ATTLIST Report ver CDATA #REQUIRED tmZone CDATA #REQUIRED>

<!ELEMENT General ( DocLocation ) >
<!ATTLIST General productName CDATA #REQUIRED productVer CDATA #REQUIRED os CDATA #REQUIRED host CDATA #REQUIRED qcserver CDATA #IMPLIED qcproject CDATA #IMPLIED SolManSolutionId CDATA #IMPLIED SolManProjectId CDATA #IMPLIED SolManTestPlanId CDATA #IMPLIED SolManTestPackageId CDATA #IMPLIED SolManUserInfoData CDATA #IMPLIED  >

<!ELEMENT BPT (DName,Res,DVer?,TSet?,TInst?,NodeArgs,AdditionalInfo*,Doc*) >
<!ATTLIST BPT rID ID #REQUIRED >

<!ELEMENT Doc (DName,ConfName?,Res,DVer?,TSet?,TInst?,RunType?,DT?,AdditionalInfo*,Step*,DIter*,Step*,Action*,Doc*,Summary?,TestMaintenanceSummary*,NodeArgs?) >
<!ATTLIST Doc rID ID #REQUIRED type (Test|BC|BPTWrapperTest|Flow|Group|Action) "Test" productName CDATA #REQUIRED BCIter CDATA #IMPLIED >

<!ELEMENT RunType ( #PCDATA )>
<!ATTLIST RunType fmStep (False|True) "False" batch (False|True) "False" upDesc (False|True) "False" upChk (False|True) "False" upAS (False|True) "False">

<!ELEMENT DName ( #PCDATA ) >

<!ELEMENT ConfName ( #PCDATA ) >

<!ELEMENT Res ( #PCDATA ) >

<!ELEMENT AdditionalInfo (AdditionalDataName,AdditionalDataValue ) >

<!ELEMENT AdditionalDataName ( #PCDATA ) >

<!ELEMENT AdditionalDataValue ( #PCDATA ) >

<!ELEMENT DVer ( #PCDATA ) >

<!ELEMENT TSet ( #PCDATA ) >

<!ELEMENT TInst ( #PCDATA ) >

<!ELEMENT DIter (Step*,Action+,Summary?,NodeArgs)>
<!ATTLIST DIter rID ID #REQUIRED iterID CDATA #REQUIRED>

<!ELEMENT DocLocation ( #PCDATA )>

<!ELEMENT Action (AName,AIter*,(Step|HtmlStep|Action)*, Summary,ActionMaintenanceSummary*, NodeArgs ) >
<!ATTLIST Action rID ID #REQUIRED>

<!ELEMENT AIter ((Step|HtmlStep|Action)*,DataMapping?, Summary?,NodeArgs) >
<!ATTLIST AIter rID ID #REQUIRED iterID CDATA #REQUIRED isCountable (False|True) "False" >

<!ELEMENT AName ( #PCDATA ) >

<!ELEMENT TestMaintenanceSummary (ActionMaintenanceSummary*) >
<!ATTLIST TestMaintenanceSummary ObjectsAdded CDATA #REQUIRED ObjectsUpdated CDATA #REQUIRED StepsUpdated CDATA #REQUIRED StepsComments CDATA #REQUIRED><!ELEMENT ActionMaintenanceSummary (ObjectChange* ) >
<!ATTLIST ActionMaintenanceSummary Action CDATA #REQUIRED Objects CDATA #REQUIRED Updated CDATA #REQUIRED LinesTotal CDATA #REQUIRED Added CDATA #REQUIRED LinesUpdated CDATA #REQUIRED>

<!ELEMENT ObjectChange  (Hierarchy, PropertyChangeList* ) >
<!ATTLIST ObjectChange Operation CDATA #IMPLIED OriginalRepository CDATA #IMPLIED>

<!ELEMENT PropertyChangeList (PropertyDef*) >

<!ELEMENT PropertyDef (OriginalValue, NewValue) >
<!ATTLIST PropertyDef PropName CDATA #REQUIRED OriginRegularExpression (True|False) "False" NewRegularExpression (True|False) "False" AddedProperty (True|False) "False" >

<!ELEMENT OriginalValue ( #PCDATA )>

<!ELEMENT NewValue ( #PCDATA )>

<!ELEMENT Hierarchy  (ObjectName, Hierarchy*) >
<!ATTLIST Hierarchy MicClass CDATA #REQUIRED>

<!ELEMENT ObjectName  ( #PCDATA ) >

<!ELEMENT Step (Obj,Details,Time,TimeTick* ,(Step|HtmlStep|Doc)*, DataMapping?, NodeArgs) >
<!ATTLIST Step rID ID #REQUIRED retval CDATA #IMPLIED>

<!ELEMENT HtmlStep (HTML,TimeTick*,(Step|HtmlStep|Doc)*,NodeArgs) >
<!ATTLIST HtmlStep rID ID #REQUIRED >

<!ELEMENT Obj ( #PCDATA ) >
<!ATTLIST Obj plainTxt (False|True) "True">

<!ELEMENT Details ( #PCDATA ) >
<!ATTLIST Details plainTxt (False|True) "True">

<!ELEMENT Time ( #PCDATA ) >

<!ELEMENT HTML ( #PCDATA ) >

<!ELEMENT Disp ( #PCDATA ) >

<!ELEMENT TimeTick ( #PCDATA ) >

<!ELEMENT DataMapping ( DataMappedItem* )>
<!ELEMENT DataMappedItem EMPTY >
<!ATTLIST DataMappedItem dsName CDATA #REQUIRED >
<!ATTLIST DataMappedItem rowId CDATA #REQUIRED >

<!ELEMENT NodeArgs (Disp,TopPane?,BtmPane?,ExtendedInfo? )>
<!ATTLIST NodeArgs eType CDATA #REQUIRED icon CDATA #REQUIRED nRep CDATA #REQUIRED UserNote CDATA #IMPLIED filter (False|True) "True">
<!ATTLIST NodeArgs status (Passed|Failed|Done|Warning|Information) "Done">
<!ATTLIST NodeArgs iconSel CDATA #IMPLIED nType CDATA #IMPLIED MovieMarker CDATA "">
<!ATTLIST NodeArgs Source CDATA #IMPLIED SourceLine CDATA #IMPLIED StepFlowItemKey CDATA #IMPLIED >

<!ELEMENT TopPane (Path)>

<!ELEMENT BtmPane ( (Path|WR)?,ASHilite?)>
<!ATTLIST BtmPane vType CDATA "HTML">

<!ELEMENT Path ( #PCDATA ) >

<!ELEMENT ASHilite ( #PCDATA ) >

<!ELEMENT WR ( #PCDATA ) >

<!ELEMENT ExtendedInfo ( StepData ) >

<!ATTLIST ExtendedInfo StepType CDATA #REQUIRED>
<!ELEMENT DT (NodeArgs) >
<!ATTLIST DT rID ID #REQUIRED>

<!ELEMENT Summary (Param*)>
<!ATTLIST Summary sTime CDATA #IMPLIED eTime CDATA #IMPLIED passed CDATA #IMPLIED failed CDATA #IMPLIED warnings CDATA #IMPLIED retval CDATA #IMPLIED stopped (False|True) "False" >

<!ELEMENT Param (ParamName,ParamVal)+ >
<!ATTLIST Param paramInOut (In|Out) "In">

<!ELEMENT ParamName ( #PCDATA ) >

<!ELEMENT ParamVal ( #PCDATA ) >

]
>
<Report ver="2.0" tmZone="GMT Standard Time">
<General productName="Micro Focus Unified Functional Testing" productVer="15.0.2" os="" host="AO2E2E919R2"><DocLocation><![CDATA[C:\Click And Collect\Automation\Test Scripts\TC020_CC_Enquiry_IncludeClosedOrders]]></DocLocation></General>
<Doc rID="T1"   productName= "Micro Focus Unified Functional Testing"  >
<DName><![CDATA[TC020_CC_Enquiry_IncludeClosedOrders]]></DName>
<Res><![CDATA[Report]]></Res>
<DT rID="T2">
<NodeArgs eType="Table" icon="739" nRep="4" filter="False" >
<Disp><![CDATA[Run-Time Data Table]]></Disp>
<BtmPane vType="Table" >
<Path><![CDATA[Default.xlsx]]></Path>
</BtmPane>
</NodeArgs>
</DT>
<DIter rID="T3" iterID="1" >
<Action rID="T4">
<AName><![CDATA[Action1]]></AName>
<Step rID="T5">
<Obj plainTxt="False" ><![CDATA[LoadFunctionLibrary]]></Obj>
<Details plainTxt="False" ><![CDATA[LoadFunctionLibrary function passed]]></Details>
<Time><![CDATA[7/15/2021 - 19:32:37]]></Time>
<TimeTick>1626373957</TimeTick>
<NodeArgs eType="Replay" icon="742" nRep="8" status="Passed" Source="Action1" SourceLine="-1" >
<Disp><![CDATA[LoadFunctionLibrary]]></Disp>
</NodeArgs>
</Step>
<Step rID="T6">
<Obj plainTxt="False" ><![CDATA[LoadFunctionLibrary]]></Obj>
<Details plainTxt="False" ><![CDATA[LoadFunctionLibrary function passed]]></Details>
<Time><![CDATA[7/15/2021 - 19:32:37]]></Time>
<TimeTick>1626373957</TimeTick>
<NodeArgs eType="Replay" icon="742" nRep="9" status="Passed" Source="Action1" SourceLine="-1" >
<Disp><![CDATA[LoadFunctionLibrary]]></Disp>
</NodeArgs>
</Step>
<Step rID="T7">
<Obj plainTxt="False" ><![CDATA[Oracle Retail Xstore Point]]></Obj>
<Details plainTxt="False" ><![CDATA[JavaWindow]]></Details>
<Time><![CDATA[7/15/2021 - 19:32:41]]></Time>
<TimeTick>1626373961</TimeTick>
<Step rID="T8">
<Obj plainTxt="False" ><![CDATA[Main Menu.Exist]]></Obj>
<Details plainTxt="False" ><![CDATA["Object does not exist"]]></Details>
<Time><![CDATA[7/15/2021 - 19:32:41]]></Time>
<TimeTick>1626373961</TimeTick>
<NodeArgs eType="Replay" icon="744" nRep="12" Source="Action1" SourceLine="-1" >
<Disp><![CDATA[Main Menu.Exist]]></Disp>
</NodeArgs>
</Step>
<Step rID="T9">
<Obj plainTxt="False" ><![CDATA[Back Office Login(st).Exist]]></Obj>
<Details plainTxt="False" ><![CDATA["Object does not exist"]]></Details>
<Time><![CDATA[7/15/2021 - 19:33:42]]></Time>
<TimeTick>1626374022</TimeTick>
<NodeArgs eType="Replay" icon="745" nRep="14" >
<Disp><![CDATA[Back Office Login(st).Exist]]></Disp>
</NodeArgs>
</Step>
<Step rID="T10">
<Obj plainTxt="False" ><![CDATA[Login.Set]]></Obj>
<Details plainTxt="False" ><![CDATA["100"]]></Details>
<Time><![CDATA[7/15/2021 - 19:33:42]]></Time>
<TimeTick>1626374022</TimeTick>
<NodeArgs eType="Replay" icon="746" nRep="16" >
<Disp><![CDATA[Login.Set]]></Disp>
</NodeArgs>
</Step>
<Step rID="T11">
<Obj plainTxt="False" ><![CDATA[Login.SetSecure]]></Obj>
<Details plainTxt="False" ><![CDATA["5fc097abb195b0915582818a640b"]]></Details>
<Time><![CDATA[7/15/2021 - 19:33:48]]></Time>
<TimeTick>1626374028</TimeTick>
<NodeArgs eType="Replay" icon="746" nRep="18" >
<Disp><![CDATA[Login.SetSecure]]></Disp>
</NodeArgs>
</Step>
<Step rID="T12">
<Obj plainTxt="False" ><![CDATA[Override.Exist]]></Obj>
<Details plainTxt="False" ><![CDATA["Object exists"]]></Details>
<Time><![CDATA[7/15/2021 - 19:33:52]]></Time>
<TimeTick>1626374032</TimeTick>
<NodeArgs eType="Replay" icon="747" nRep="19" >
<Disp><![CDATA[Override.Exist]]></Disp>
</NodeArgs>
</Step>
<Step rID="T13">
<Obj plainTxt="False" ><![CDATA[Override.Click]]></Obj>
<Details plainTxt="False" ><![CDATA["LEFT"]]></Details>
<Time><![CDATA[7/15/2021 - 19:33:52]]></Time>
<TimeTick>1626374032</TimeTick>
<NodeArgs eType="Replay" icon="747" nRep="21" >
<Disp><![CDATA[Override.Click]]></Disp>
</NodeArgs>
</Step>
<Step rID="T14">
<Obj plainTxt="False" ><![CDATA[Additional Options.Click]]></Obj>
<Details plainTxt="False" ><![CDATA["LEFT"]]></Details>
<Time><![CDATA[7/15/2021 - 19:33:53]]></Time>
<TimeTick>1626374033</TimeTick>
<NodeArgs eType="Replay" icon="747" nRep="23" Source="Action1" SourceLine="-1" >
<Disp><![CDATA[Additional Options.Click]]></Disp>
</NodeArgs>
</Step>
<Step rID="T15">
<Obj plainTxt="False" ><![CDATA[Click & Collect.Click]]></Obj>
<Details plainTxt="False" ><![CDATA["LEFT"]]></Details>
<Time><![CDATA[7/15/2021 - 19:33:55]]></Time>
<TimeTick>1626374035</TimeTick>
<NodeArgs eType="Replay" icon="747" nRep="25" Source="Action1" SourceLine="-1" >
<Disp><![CDATA[Click & Collect.Click]]></Disp>
</NodeArgs>
</Step>
<Step rID="T16">
<Obj plainTxt="False" ><![CDATA[Enquiry.Click]]></Obj>
<Details plainTxt="False" ><![CDATA["LEFT"]]></Details>
<Time><![CDATA[7/15/2021 - 19:33:57]]></Time>
<TimeTick>1626374037</TimeTick>
<NodeArgs eType="Replay" icon="747" nRep="27" Source="Action1" SourceLine="-1" >
<Disp><![CDATA[Enquiry.Click]]></Disp>
</NodeArgs>
</Step>
<Step rID="T17">
<Obj plainTxt="False" ><![CDATA[Search Criteria.Select]]></Obj>
<Details plainTxt="False" ><![CDATA["All Orders"]]></Details>
<Time><![CDATA[7/15/2021 - 19:33:59]]></Time>
<TimeTick>1626374039</TimeTick>
<NodeArgs eType="Replay" icon="744" nRep="29" Source="Action1" SourceLine="-1" >
<Disp><![CDATA[Search Criteria.Select]]></Disp>
</NodeArgs>
</Step>
<Step rID="T18">
<Obj plainTxt="False" ><![CDATA[icon-checkbox.Set]]></Obj>
<Details plainTxt="False" ><![CDATA["ON"]]></Details>
<Time><![CDATA[7/15/2021 - 19:34:01]]></Time>
<TimeTick>1626374041</TimeTick>
<NodeArgs eType="Replay" icon="748" nRep="31" Source="Action1" SourceLine="-1" >
<Disp><![CDATA[icon-checkbox.Set]]></Disp>
</NodeArgs>
</Step>
<Step rID="T19">
<Obj plainTxt="False" ><![CDATA[DtvList.Exist]]></Obj>
<Details plainTxt="False" ><![CDATA["Object exists"]]></Details>
<Time><![CDATA[7/15/2021 - 19:34:05]]></Time>
<TimeTick>1626374045</TimeTick>
<NodeArgs eType="Replay" icon="744" nRep="32" Source="Action1" SourceLine="-1" >
<Disp><![CDATA[DtvList.Exist]]></Disp>
</NodeArgs>
</Step>
<NodeArgs eType="Context" icon="743" nRep="11" Source="Action1" SourceLine="-1" >
<Disp><![CDATA[Oracle Retail Xstore Point]]></Disp>
</NodeArgs>
</Step>
<Step rID="T20">
<Obj ><![CDATA[Till Enquiry All Orders list Include Closed Orders]]></Obj>
<Details ><![CDATA[The All Orders list including closed orders in Enquiry is displayed as expected]]></Details>
<Time><![CDATA[7/15/2021 - 19:34:05]]></Time>
<TimeTick>1626374045</TimeTick>
<NodeArgs eType="User" icon="749" nRep="33" status="Passed" Source="Action1" SourceLine="-1" >
<Disp><![CDATA[Till Enquiry All Orders list Include Closed Orders]]></Disp>
</NodeArgs>
</Step>
<Step rID="T21">
<Obj plainTxt="False" ><![CDATA[Oracle Retail Xstore Point]]></Obj>
<Details plainTxt="False" ><![CDATA[JavaWindow]]></Details>
<Time><![CDATA[7/15/2021 - 19:34:15]]></Time>
<TimeTick>1626374055</TimeTick>
<Step rID="T22">
<Obj plainTxt="False" ><![CDATA[Log Off.Click]]></Obj>
<Details plainTxt="False" ><![CDATA["LEFT"]]></Details>
<Time><![CDATA[7/15/2021 - 19:34:15]]></Time>
<TimeTick>1626374055</TimeTick>
<NodeArgs eType="Replay" icon="747" nRep="36" Source="Action1" SourceLine="-1" >
<Disp><![CDATA[Log Off.Click]]></Disp>
</NodeArgs>
</Step>
<Step rID="T23">
<Obj plainTxt="False" ><![CDATA[Stop Run]]></Obj>
<Details plainTxt="False" ><![CDATA[Run stopped by user.]]></Details>
<Time><![CDATA[7/15/2021 - 19:34:15]]></Time>
<TimeTick>1626374055</TimeTick>
<NodeArgs eType="General" icon="750" nRep="37" status="Information" >
<Disp><![CDATA[Stop Run]]></Disp>
</NodeArgs>
</Step>
<NodeArgs eType="Context" icon="743" nRep="35" Source="Action1" SourceLine="-1" >
<Disp><![CDATA[Oracle Retail Xstore Point]]></Disp>
</NodeArgs>
</Step>
<Summary sTime="7/15/2021 - 19:32:34" eTime="7/15/2021 - 19:34:15" passed="3" failed="0" warnings="0" ></Summary>
<NodeArgs eType="StartAction" icon="741" nRep="7" status="Passed" >
<Disp><![CDATA[Action1 Summary]]></Disp>
</NodeArgs>
</Action>
<NodeArgs eType="StartIteration" icon="740" nRep="6" status="Passed" >
<Disp><![CDATA[TC020_CC_Enquiry_IncludeClosedOrders Iteration 1 (Row 1)]]></Disp>
</NodeArgs>
</DIter>
<Summary sTime="7/15/2021 - 19:32:32" eTime="7/15/2021 - 19:34:15" passed="3" failed="0" warnings="0" ></Summary>
<NodeArgs eType="StartTest" icon="738" nRep="3" status="Passed" >
<Disp><![CDATA[Test TC020_CC_Enquiry_IncludeClosedOrders Summary]]></Disp>
</NodeArgs>
</Doc>
</Report>